name,address,Is Early Voting,Precincts (Or Locality-wide),Is Drop Off,lon,lat,V11
AMISSVILLE FIRE HALL,"14711 LEE HWY AMISSVILLE, VA 20106-4227",False,201 - AMISSVILLE - 0000,False,-78.00112,38.67747,
CHESTER GAP FIRE HALL,"42 WATERFALL RD CHESTER GAP, VA 22623-2028",False,501 - CHESTER GAP - 0000,False,-78.13582,38.85143,
Castleton Community Volunteer Firehouse,"593 CASTLETON VIEW RD CASTLETON, VA 22716",False,401 - SCRABBLE - 0000,False,-78.10702,38.61176,
FLINT HILL FIRE HALL,"945 FODDERSTACK ROAD FLINT HILL, VA 22627",False,502 - FLINT HILL - 0000,False,-78.10071,38.76272,
Rappahannock County Registrar Office,262 GAY STREET A WASHINGTON VA 22747,True,Locality wide location,False,-78.15929,38.71175,
SPERRYVILLE FIRE HALL,"11871 LEE HWY SPERRYVILLE, VA 22740-2127",False,301 - SPERRYVILLE - 0000,False,-78.23912,38.65659,
WASHINGTON FIRE HALL,"10 FIREHOUSE LN WASHINGTON, VA 22747-1924",False,"101 - WASHINGTON - 0000, 101 - WASHINGTON - 2590",False,-78.15393,38.7138,
Rappahannock County Registrar Office,262 GAY ST WASHINGTON VA 22747,True,Locality wide location,False,-78.15929,38.71175,
