name,address,Is Early Voting,Precincts (Or Locality-wide),Is Drop Off,lon,lat,V11
CHERITON UNITED METHODIST FELLOWSHIP HALL,"21309 SOUTH BAYSIDE RD CHERITON, VA 23316",False,"201 - PRECINCT 2-1 - 0000, 201 - PRECINCT 2-1 - 0001",False,-75.97066,37.287,
EXMORE FIRE STATION,"3356 MAIN STREET EXMORE, VA 23350",False,"501 - PRECINCT 5-1 - 0001, 501 - PRECINCT 5-1 - 0002, 501 - PRECINCT 5-1 - 0000",False,-75.82339,37.52967,
FIRE & RESCUE NASSAWADOX,"10239 PINE AVE NASSAWADOX, VA 23413",False,"301 - PRECINCT 3-1 - 0000, 301 - PRECINCT 3-1 - 1691",False,-75.85635,37.48025,
JOHNSON'S UNITED METHODIST SOCIAL HALL,"11175 BAYSIDE RD MACHIPONGO, VA 23405",False,"401 - PRECINCT 4-1 - 0001, 401 - PRECINCT 4-1 - 0000",False,-75.91595,37.42757,
TRINITY UMC FELLOWSHIP HALL,"410 TAZEWELL AVE CAPE CHARLES, VA 23310",False,"101 - PRECINCT 1-1 - 0000, 101 - PRECINCT 1-1 - 0400",False,-76.01589,37.26881,
